{
 "schema_version": "1.0.0",
 "bundle": "standard-governance",
 "normalisation": "strip leading UTF-8 BOM; CRLF to LF (binary left as read); sha256 hex",
 "generated_from": "bundles/standard-governance/standard-governance-<version>.bundle.json (one per packed release)",
 "versions": [
  {
   "version": "1.0.0",
   "content_hash": "715f91632bab06d5d3f42b09e240f4e695558a4e3a6b3d5999d69ffe8b295338",
   "file_count": 89
  },
  {
   "version": "1.1.0",
   "content_hash": "91d498442f06e46499b54ccfff03e15be7ddc91c4bb2d60e1361860d3d95b849",
   "file_count": 90
  },
  {
   "version": "1.2.0",
   "content_hash": "03422fbd912d23ac300caa7ea8c2cdd0063f0a502a7266bd8fb6106fb66fd2a2",
   "file_count": 90
  },
  {
   "version": "1.2.1",
   "content_hash": "cd0ce0b34d83e70044392f966b4a2934813aa186f16f89c361d329eaca5cba3f",
   "file_count": 92
  },
  {
   "version": "1.2.2",
   "content_hash": "41ce850fdbb1ac66047e7a9823a585324c1f77cb2ab8a15c1fa9e1a407f88c39",
   "file_count": 92
  },
  {
   "version": "1.2.3",
   "content_hash": "559ead306531b5b85b77b1f83189128527f4188649f42cd9b19a699f40159e55",
   "file_count": 92
  },
  {
   "version": "1.2.4",
   "content_hash": "278415c5316c0ac1f5f9bf9af69e03c480593fecae541b844ebe0e18ab9637a3",
   "file_count": 92
  },
  {
   "version": "1.2.5",
   "content_hash": "8187f0ef1d6dbbafffdc602fb15e5598873ecf501c566f0b926383e5507d087e",
   "file_count": 92
  },
  {
   "version": "1.2.6",
   "content_hash": "8a83c0df2d9ba5c9831e479fd4eadc246032d62e61564aa829f1115268df6562",
   "file_count": 92
  },
  {
   "version": "1.2.7",
   "content_hash": "d11103a08b4580540f6c9d02e49d95b07e1f20c37d0ffeb324c960b78c905fb8",
   "file_count": 92
  },
  {
   "version": "1.3.0",
   "content_hash": "30e9bd511394b250755d171ce394b4573246fa8ad6663ddf4157da35f77d328a",
   "file_count": 94
  },
  {
   "version": "1.4.0",
   "content_hash": "a71a99e4fe696e956ba23c33c2cccaa555e36947f501691a24cf8307c3a4f55d",
   "file_count": 94
  },
  {
   "version": "1.4.1",
   "content_hash": "494a1e89e1938df12facc85d8eedf2ce0ae57413d1c9970acb755073e9125f9d",
   "file_count": 100
  },
  {
   "version": "1.4.2",
   "content_hash": "0ce85f2ba9eac876e293099beaf2c5dfcf6ee7d87b398ad2d2b5fc8c3533f489",
   "file_count": 103
  },
  {
   "version": "1.4.3",
   "content_hash": "b2fd7216bab9a6dcbaf56a128c17444fb403d754fe49fb1d29489c975f649a1c",
   "file_count": 103
  },
  {
   "version": "1.4.4",
   "content_hash": "bfe27602939808e50ea42e47e762bfdb7f1560bd88b92807504da656f57d7a80",
   "file_count": 103
  },
  {
   "version": "1.4.5",
   "content_hash": "20c8653f5f0a30765c9da5dc9f7fb73af8078edd81804f2c4c1f05c1882dcfa5",
   "file_count": 105
  },
  {
   "version": "1.4.6",
   "content_hash": "005e7cde1590c8114cb05c810e850093f1d4b21420083f90cf8d84d249b39bb3",
   "file_count": 105
  },
  {
   "version": "1.4.7",
   "content_hash": "84a0b2554d8a6773fc4426605a70cc9377fcc446db68d99cb047e585512bb3c2",
   "file_count": 106
  },
  {
   "version": "1.4.8",
   "content_hash": "317e094fea7f3cadc0ebb46dc26bfa90e1871f143f89f0f8db2507a4a413dc95",
   "file_count": 108
  },
  {
   "version": "1.4.9",
   "content_hash": "51af9e9be8b309f9619be2e87b2faae11a6ec3e7c48a03482857ef54d7ce6662",
   "file_count": 109
  },
  {
   "version": "1.5.0",
   "content_hash": "7aa07587e794d75cfccc496d7ab5ad1a431917902b665209bfb78ba75fdadcf9",
   "file_count": 115
  },
  {
   "version": "1.5.1",
   "content_hash": "7aa07587e794d75cfccc496d7ab5ad1a431917902b665209bfb78ba75fdadcf9",
   "file_count": 115
  },
  {
   "version": "1.5.2",
   "content_hash": "b1312f01c03a3d7e5df4363501f15589b5a82f389a2984060d4532b07002a72b",
   "file_count": 115
  },
  {
   "version": "1.5.3",
   "content_hash": "4b9910c998090284ea6fe804d273bf8ba4596fde46b49b5605f264143b6d9219",
   "file_count": 115
  },
  {
   "version": "1.5.4",
   "content_hash": "e3d3f0e2d4c4f4f890dab351a4cdaeaa743a8bee627e3cf2051aa9da68a393cf",
   "file_count": 115
  },
  {
   "version": "1.5.5",
   "content_hash": "9b6dccc749a19ad53c2c0ed47cc9d9b835a958cb547148ce294fecbcca764d20",
   "file_count": 115
  },
  {
   "version": "1.5.6",
   "content_hash": "3d99ef42cf80f60684be6f55ef6629c062f3a1ffc2e5a7824e9e28646cc17116",
   "file_count": 119
  },
  {
   "version": "1.5.7",
   "content_hash": "68a930b8519b99cbb6d08871eca76aa4f0d2719055e3bdb40e99d3cc088d27ca",
   "file_count": 119
  },
  {
   "version": "1.5.9",
   "content_hash": "b564b206d8371027f076e5130a7d02b925361328f35570ec224cb2455688312b",
   "file_count": 128
  },
  {
   "version": "1.6.0",
   "content_hash": "1a2d2ea93cdd33eb934956a2a2554cbec68eed9249a9262cdf14983f5cd55ead",
   "file_count": 139
  },
  {
   "version": "1.6.1",
   "content_hash": "6f37a9edfb8c57fbd9f9ce62aaccf2eb09b075c341237183da540a790db6eedb",
   "file_count": 143
  },
  {
   "version": "1.6.2",
   "content_hash": "6a2bfe48311ed29db75d73eda1a58b98ab20664d432eb9405254805675e385fd",
   "file_count": 147
  },
  {
   "version": "1.6.3",
   "content_hash": "20f059c1656fe34df3962783ff577afbd19ef1d78a96bb467bbdb77b79bfb8ed",
   "file_count": 147
  },
  {
   "version": "1.6.5",
   "content_hash": "4398ba626b1b1481bbb4ab7c37e8acb48029d68b2750798e5d3dc97bb4aef647",
   "file_count": 151
  },
  {
   "version": "1.6.6",
   "content_hash": "bb8796d833c280767beb33317e0e48898fdfc0a28686f8b0bfd9f515eff6dc7c",
   "file_count": 151
  },
  {
   "version": "1.6.7",
   "content_hash": "738cd6eed1d5b8a625629c53379095588dcee6e2b017a0e07c5da6eafd570e9e",
   "file_count": 152
  },
  {
   "version": "1.6.8",
   "content_hash": "b9b437dba9fe75a98819ec2e77f7f5d37694b1859f6afbfdd8ab10f1867d5bf3",
   "file_count": 151
  },
  {
   "version": "1.6.9",
   "content_hash": "acbf60d9e983592ea3159ea0f91ff6fd05c8b514eff41fc81a7eb2a45bc5a51c",
   "file_count": 151
  },
  {
   "version": "1.6.10",
   "content_hash": "699ae23acbb4da7303b33eaf90d348d398a8aff172469924f7ca723c4c7f8ede",
   "file_count": 152
  },
  {
   "version": "1.6.11",
   "content_hash": "d2be55b6275247dd598071b519e85c1a94004f9c4aed5981b1fc4b8e5ad7a797",
   "file_count": 152
  },
  {
   "version": "1.6.12",
   "content_hash": "9a8266d32bf61d57e0c55daeeda1c80cfe3f0ba9cb4232bb014619489d62b251",
   "file_count": 152
  },
  {
   "version": "1.6.13",
   "content_hash": "7e8b2ab93ee86617edd3badc3ed9ab910eb4e055cfa6825ca7d371fd62c595f8",
   "file_count": 152
  },
  {
   "version": "1.6.14",
   "content_hash": "fa24df0a24004c7e7a4d2b1c13ff2f6973e9af9409aac916863f32d89de28d5a",
   "file_count": 152
  },
  {
   "version": "1.6.15",
   "content_hash": "a66c9b65293214aad7c264cd0722954dd4e88fb2465eb7b170368b4893a164b7",
   "file_count": 153
  },
  {
   "version": "1.6.16",
   "content_hash": "da0006fa96e54d545f9afefedd7f991929e616d87802d1e2bdcd6eefade1327b",
   "file_count": 153
  },
  {
   "version": "1.6.17",
   "content_hash": "da0006fa96e54d545f9afefedd7f991929e616d87802d1e2bdcd6eefade1327b",
   "file_count": 153
  },
  {
   "version": "1.6.18",
   "content_hash": "d5c1b0544cf30b0d35fdc7c7541c1e9df96c4f68d981e6f621671d62f4c2dba7",
   "file_count": 153
  },
  {
   "version": "1.6.19",
   "content_hash": "cd11e2f2e4e1a2b88894fbe5379dc5dd16d6cafe7db1e174830cfa01f55347a3",
   "file_count": 153
  },
  {
   "version": "1.6.20",
   "content_hash": "21bcb326ebb0ac18f87ba8d14f85c5a3100afd24bcd94ffeb8cba2429e4ea12c",
   "file_count": 153
  },
  {
   "version": "1.7.0",
   "content_hash": "7fe920c0370d64da04c627ca68b5d068d8b4ca866be23dd1bde2e4fe1548b7ec",
   "file_count": 158
  },
  {
   "version": "1.7.1",
   "content_hash": "01c277633e0279a919283720b3f725a364b49cd4d5d38b6f477305f13d14ffc6",
   "file_count": 158
  },
  {
   "version": "1.8.0",
   "content_hash": "74d9b39746cb060446a529367ae8a2a47add24a8f2a623a05746478171f184ba",
   "file_count": 176
  },
  {
   "version": "1.8.1",
   "content_hash": "588388ee3a8eeaa725c0d865b242d3ad4acc4d890bb05adb07ba830bb501bbfd",
   "file_count": 180
  },
  {
   "version": "1.8.2",
   "content_hash": "a59b6af868e6634fd261f17eddff556d5a8bfe575088b6a3589ba6d507662b92",
   "file_count": 180
  },
  {
   "version": "1.8.3",
   "content_hash": "7174329a747f848f7467860cfa259f5d6f17eb954cd7390c74a0d20695893189",
   "file_count": 180
  },
  {
   "version": "1.8.4",
   "content_hash": "7e4811e583ba8968ca12b78af174555bdf010eb1107553310dadf287e0e1a9cc",
   "file_count": 180
  },
  {
   "version": "1.8.5",
   "content_hash": "6fc765fa805dc1e457e42510555c294fb70a144c04ed792af8434ab61ae94d83",
   "file_count": 180
  },
  {
   "version": "1.8.6",
   "content_hash": "f47a4ea5ba12680bb6c896f75362e2b79c3c5ef10c40a54c1f9ddc8f1867596b",
   "file_count": 181
  },
  {
   "version": "1.8.7",
   "content_hash": "384af2c8219f2ef801eb62e8735881bf92365d98d90e43d79f06e738f87ae5b1",
   "file_count": 189
  },
  {
   "version": "1.8.8",
   "content_hash": "cc6ffd68e14ab89e88014d0c051c29092c04c6269e79157977d0f738a1d69aaa",
   "file_count": 192
  },
  {
   "version": "1.8.9",
   "content_hash": "b9af78a6c84c273777a973b84f7adb7126c231a8e89640d5091f7f2da8957bde",
   "file_count": 192
  },
  {
   "version": "1.8.10",
   "content_hash": "cab29f349795a4bc891e94dd47a6af6a6d6bd0432335a0654dae559b32429aac",
   "file_count": 192
  },
  {
   "version": "1.8.11",
   "content_hash": "",
   "file_count": 192
  }
 ],
 "files": {
  ".claude/agents/README.md": [
   {
    "sha256": "808e024968a0e50fddc484c26cdedff09be7b79ceb1a297b65f8d2b1388cd5ff",
    "versions": [
     "1.5.9"
    ]
   },
   {
    "sha256": "2166769f6cd6e13f5c8f8f901bb25294de1023e3f8ee6220cd0515f9a94da7ff",
    "versions": [
     "1.6.0..1.8.1"
    ]
   },
   {
    "sha256": "deb0d3d8eddae9560b8671743308aebede57bbc36bfbc821c0a4779d64770a1b",
    "versions": [
     "1.8.2..1.8.11"
    ]
   }
  ],
  ".claude/agents/analyst.md": [
   {
    "sha256": "a8e20194f3c504a40e1075f027c3ba835a376dc17267c8c9d83f7f39a6fa4d1b",
    "versions": [
     "1.0.0..1.8.1"
    ]
   },
   {
    "sha256": "776cf0fd237dd73888cd9d37a12b628d1a804f27283ab609e8c65012cef0e9d8",
    "versions": [
     "1.8.2"
    ]
   },
   {